{
  "$schema": "https://json-schema.org/draft/2020-12/schema",
  "$id": "https://github.com/microsoft/chaos-studio/blob/main/copilot-cli-plugin/schemas/chaos-loop/external-gate.v1.schema.json",
  "title": "Chaos Loop External Merge and Deploy Gate v1",
  "type": "object",
  "additionalProperties": false,
  "required": ["schemaVersion", "runId", "expectedStateRevision", "changes"],
  "properties": {
    "schemaVersion": { "const": "chaos-loop-gate/v1" },
    "runId": { "type": "string", "minLength": 1 },
    "expectedStateRevision": { "type": "integer", "minimum": 0 },
    "changes": {
      "type": "array",
      "minItems": 1,
      "items": { "$ref": "#/$defs/change" }
    }
  },
  "$defs": {
    "utcTimestamp": {
      "type": "string",
      "pattern": "^\\d{4}-\\d{2}-\\d{2}T\\d{2}:\\d{2}:\\d{2}(?:\\.\\d+)?Z$"
    },
    "evidence": {
      "type": "object",
      "additionalProperties": false,
      "required": ["stage", "name", "source", "observedAt", "value"],
      "properties": {
        "stage": {
          "enum": ["merge", "build", "artifact", "deployment", "serving-revision"]
        },
        "name": { "type": "string", "minLength": 1 },
        "source": { "type": "string", "minLength": 1 },
        "observedAt": { "$ref": "#/$defs/utcTimestamp" },
        "value": { "type": "string", "minLength": 1 }
      }
    },
    "change": {
      "type": "object",
      "additionalProperties": false,
      "required": [
        "changeId",
        "prUrl",
        "mergeCommit",
        "targetEnv",
        "expectedBuildId",
        "observedBuildId",
        "expectedArtifact",
        "observedArtifact",
        "expectedDeploymentId",
        "observedDeploymentId",
        "expectedRevision",
        "observedRevision",
        "live",
        "evidence"
      ],
      "properties": {
        "changeId": { "type": "string", "minLength": 1 },
        "prUrl": { "type": "string", "format": "uri", "minLength": 1 },
        "mergeCommit": { "type": "string", "minLength": 7 },
        "targetEnv": { "type": "string", "minLength": 1 },
        "expectedBuildId": { "type": "string", "minLength": 1 },
        "observedBuildId": { "type": "string", "minLength": 1 },
        "expectedArtifact": { "type": "string", "minLength": 1 },
        "observedArtifact": { "type": "string", "minLength": 1 },
        "expectedDeploymentId": { "type": "string", "minLength": 1 },
        "observedDeploymentId": { "type": "string", "minLength": 1 },
        "expectedRevision": { "type": "string", "minLength": 1 },
        "observedRevision": { "type": "string", "minLength": 1 },
        "live": { "const": true },
        "evidence": {
          "type": "array",
          "minItems": 5,
          "maxItems": 5,
          "items": { "$ref": "#/$defs/evidence" }
        }
      }
    }
  }
}
